{"body":{"cryptography":"46.0.4","dependency_closure":"NOT_YET_MEASURED","guard":{"checks":[{"status":"PASS","test":"ipv4-socket"},{"status":"PASS","test":"ipv6-socket"},{"status":"PASS","test":"unix-socket"},{"status":"PASS","test":"native-libc-socket"},{"status":"PASS","test":"raw-socket"},{"status":"PASS","test":"io-uring"},{"status":"PASS","test":"exec-inherits-filter"},{"status":"PASS","test":"no-inherited-socket-fds"}],"hostile_agent_confinement":"not-claimed","launcher_sha256":"dfb7d035d3f800985804af3e7632f153c5d9b3adf0a12f6549b27bf06cd2f9fc","namespace_isolation":"not-claimed","profile":"linux-seccomp-v1","proof_level":"local enforcement observations, not remote attestation","scope":"socket syscalls and inherited socket descriptors; trusted host and fixture filesystem"},"interpreter_sha256":"17b78e0a93175e86f9ac03141924fd7a7f0c0c52e66b34bfa0de20ffef989df1","machine":"x86_64","platform":"Linux-6.18.44-x86_64-with-glibc2.41","python":"3.13.5"},"proof":null,"refs":{},"type":"test-environment","v":1}