{"body":{"network_started":false,"readiness":"NOT_ISSUED","required_gate_status":{"accounting":"PENDING_FULL_ACCEPTANCE","agent-confinement":"PENDING_FULL_ACCEPTANCE","authority":"PENDING_FULL_ACCEPTANCE","build-identity":"PENDING_FULL_ACCEPTANCE","canonical":"PENDING_FULL_ACCEPTANCE","crash-consistency":"PENDING_FULL_ACCEPTANCE","execution":"PENDING_FULL_ACCEPTANCE","hashes":"PENDING_FULL_ACCEPTANCE","independent-vectors":"PENDING_FULL_ACCEPTANCE","network-zero":"PENDING_FULL_ACCEPTANCE","policy":"PENDING_FULL_ACCEPTANCE","readiness-supervisor":"PENDING_FULL_ACCEPTANCE","recovery":"PENDING_FULL_ACCEPTANCE","replay":"PENDING_FULL_ACCEPTANCE","revocation":"PENDING_FULL_ACCEPTANCE","rollback-anchor":"PENDING_FULL_ACCEPTANCE","signatures":"PENDING_FULL_ACCEPTANCE","store":"PENDING_FULL_ACCEPTANCE"},"signer_purpose":"ephemeral-test-evidence-only","status":"REFERENCE_PASS","warning":"Fixture tests are not production conformance or remote attestation."},"proof":{"algorithm":"ed25519","public_key":"ae720c10356f26a0add680e87f2f051fb510ca6bbd6ed9d0a6c36afd678ed848","signature":"0bfaab9ea315123248afbe1cd427f1486098d999972dd9695d4fb06cec52af9483219ef8b74b9d7c0e5c2bba89166b49338d1b52ce2f87006652fd3e3dd3e807"},"refs":{"build":"sk1:sha256:6163ac83255e76296817596714bf76eda081aac285cda667d61d47ba7bd8cc00","environment":"sk1:sha256:dc5ad1c9939416541e6551236e45a14b8fdf1d4ba2277f50dcf8e2afabd233d6","requirements":"sk1:sha256:7355aa4707fc0421797f275f29ecc8ae8618b713ba22c220d09a2d16ce82af3e","tests":"sk1:sha256:03504ce09d554209ed523abefeb8fa13b20b8f4e73c324e870902b53f2b8aac9"},"type":"local-conformance-run","v":1}